occupation_code,occupation_name,isco08_code,isco08_title,major_category,task_count,ksa_count,substitutivity_01,augmentation_01,complementarity_01,substitutivity_5,augmentation_5,complementarity_5,exposure_index_rho,agentic_potential,cognitive_requirement,physicality_intensity,language_intensity,connecting_labor_flag,connecting_labor_depth,vibe_coding_flag,vibe_coding_depth,isco08_status
4-08-05-05,机动车检测工,7412,Motor Vehicle and Mobile Equipment Mechanics and Repairers,7,10,9,0.5045,0.709,0.5315,3,4,3,0.5045,0,65,35,60,1,3,0,0,verified
4-08-05-06,计量员,3126,Metrology Technician,3,10,9,0.415,0.74,0.585,3,4,3,0.415,0,65,35,60,1,3,0,0,unmatched
4-08-05-07,电子电气产品检验员L,3126,Electrical and Electronics Engineering Technicians,3,10,9,0.448,0.649,0.64,3,4,4,0.448,0,68,25,65,1,3,0,0,unmatched
4-08-05-08,公路水运工程试验检测员,3126,Civil Engineering Technicians,3,10,9,0.4825,0.7075,0.68,3,4,4,0.4825,0,65,40,70,1,3,0,0,unmatched
4-08-05-09,建设工程质量检测员,3126,Building and Related Trades Inspectors,3,10,9,0.435,0.673,0.679,3,4,4,0.435,0,65,40,70,1,3,0,0,unmatched
4-08-06-00,环境监测员L,3126,Environmental Protection Technician,3,10,9,0.4835,0.7315,0.67,3,4,4,0.4835,0,65,40,60,1,3,0,0,unmatched
4-08-07-01,地勘钻探工,7111,Drilling and Well Workers,7,10,9,0.3555,0.6705,0.6615,2,4,4,0.3555,0,65,85,40,1,2,0,0,verified
4-08-07-02,地勘掘进工,7126,Underground Construction Workers,7,10,9,0.3875,0.718,0.615,3,4,3,0.3875,0,45,92,35,1,3,0,0,verified
4-08-07-03,物探工,7126,Surveying and Mapping Technicians,7,10,9,0.468,0.698,0.7005,3,4,4,0.468,0,65,45,60,1,3,0,0,verified
4-08-07-04,地质调查员L,2142,Geologists and Geophysicists,2,10,9,0.4045,0.6885,0.703,3,4,4,0.4045,0,75,60,65,1,3,0,0,verified
4-08-07-05,地质实验员,3126,Geological and mining technicians,3,10,9,0.3785,0.658,0.7565,3,4,4,0.3785,0,65,35,60,1,3,0,0,unmatched
4-08-08-01,花艺环境设计师,2166,Graphic and multimedia designers,2,10,9,0.3165,0.714,0.6175,2,4,3,0.3165,0,72,45,68,1,3,0,0,verified
4-08-08-02,纺织面料设计师,2163,Graphic and multimedia designers,2,10,9,0.5325,0.7095,0.7215,3,4,4,0.5325,0,72,25,65,1,3,0,0,verified
4-08-08-03,家用纺织品设计师,2166,Graphic and multimedia designers,2,10,9,0.4475,0.65,0.585,3,4,3,0.4475,0,72,25,65,1,3,0,0,verified
4-08-08-04,色彩搭配师,2166,Graphic and multimedia designers,2,10,9,0.442,0.651,0.6135,3,4,3,0.442,0,75,20,65,1,3,0,0,verified
4-08-08-05,工艺美术品设计师,2149,Design Professionals Not Elsewhere Classified,2,10,9,0.3715,0.632,0.65,2,4,4,0.3715,0,75,30,65,1,3,0,0,unmatched
4-08-08-06,装潢美术设计师,2166,Graphic and multimedia designers,2,10,9,0.3995,0.657,0.5855,3,4,3,0.3995,0,75,20,65,1,3,0,0,verified
4-08-08-07,室内装饰设计师,2163,Graphic and multimedia designers,2,10,9,0.3855,0.646,0.676,3,4,4,0.3855,0,75,25,65,1,3,0,0,verified
4-08-08-08,广告设计师,2166,Graphic and multimedia designers,2,10,9,0.4415,0.6695,0.69,3,4,4,0.4415,0,75,20,65,1,3,0,0,verified
4-08-08-09,包装设计师,2166,Graphic and multimedia designers,2,10,9,0.509,0.7145,0.7505,3,4,4,0.509,0,75,20,65,1,3,0,0,verified
4-08-08-10,玩具设计师,2149,Design Professionals Not Elsewhere Classified,2,10,9,0.479,0.7205,0.652,3,4,4,0.479,0,72,35,65,1,3,0,0,unmatched
4-08-08-11,首饰设计师,2149,Design Professionals Not Elsewhere Classified,2,10,9,0.4135,0.629,0.692,3,4,4,0.4135,0,75,30,60,1,3,0,0,unmatched
4-08-08-12,家具设计师,2144,Industrial and product designers,2,10,9,0.328,0.715,0.7425,2,4,4,0.328,0,75,20,65,1,3,0,0,verified
4-08-08-13,陶瓷产品设计师,2163,Graphic and multimedia designers,2,10,9,0.41,0.6515,0.705,3,4,4,0.41,0,72,35,65,1,3,0,0,verified
4-08-08-14,彩灯艺术设计师,2166,Graphic and multimedia designers,2,10,9,0.473,0.7005,0.596,3,4,3,0.473,0,72,35,65,1,3,0,0,verified
4-08-08-15,地毯设计师,2166,Graphic and multimedia designers,2,10,9,0.4275,0.7005,0.7125,3,4,4,0.4275,0,72,25,65,1,3,0,0,verified
4-08-08-16,皮具设计师,2149,Design Professionals Not Elsewhere Classified,2,9,9,0.5255,0.6435,0.518,3,4,3,0.5255,0,75,40,65,1,3,0,0,unmatched
4-08-08-17,鞋类设计师,2163,Graphic and multimedia designers,2,10,9,0.3705,0.6905,0.6825,2,4,4,0.3705,0,72,25,65,1,3,0,0,verified
4-08-08-18,灯具设计师,2163,Graphic and multimedia designers,2,10,9,0.6105,0.7735,0.611,3,4,3,0.6105,0,75,20,65,1,3,0,0,verified
4-08-08-19,照明设计师,2142,Architects,2,10,9,0.486,0.698,0.5665,3,4,3,0.486,0,75,20,65,1,3,0,0,verified
4-08-08-20,形象设计师,2431,Advertising and Marketing Professionals,2,10,9,0.4305,0.645,0.641,3,4,4,0.4305,0,72,45,68,1,3,0,0,verified
4-08-08-21,会展设计师,2163,Graphic and multimedia designers,2,10,9,0.3825,0.651,0.6175,3,4,3,0.3825,0,72,25,68,1,3,0,0,verified
4-08-08-22,建筑幕墙设计师,2142,Civil engineers,2,10,9,0.395,0.637,0.605,3,4,3,0.395,0,78,25,65,1,3,0,0,verified
4-08-08-23,建筑信息模型技术员L/S,3126,Building and related trades drafter,3,10,9,0.538,0.711,0.462,3,4,3,0.538,0,72,15,65,1,3,0,0,unmatched
4-08-08-24,乐器设计师,2149,Engineering Professionals Not Elsewhere Classified,2,10,9,0.5645,0.752,0.676,3,4,4,0.5645,0,85,30,60,1,3,0,0,unmatched
4-08-08-25,斫琴师,7412,Musicians,7,10,9,0.282,0.586,0.685,2,3,4,0.282,0,75,40,30,1,3,0,0,verified
4-08-08-26,工业设计工艺师S,2149,Engineering Professionals Not Elsewhere Classified,2,10,9,0.3905,0.7,0.6095,3,4,3,0.3905,0,75,20,65,1,3,0,0,unmatched
4-08-08-27,钟表设计师,2149,Engineering Professionals Not Elsewhere Classified,2,10,9,0.3575,0.6785,0.6425,2,4,4,0.3575,0,85,20,65,1,3,0,0,unmatched
4-08-08-28,漆艺师,2149,Artists and related professionals,2,10,9,0.317,0.534,0.683,2,3,4,0.317,0,75,40,65,1,3,0,0,unmatched
4-08-08-29,桌面游戏设计师S,2166,Graphic and multimedia designers,2,10,9,0.4085,0.6225,0.6475,3,3,4,0.4085,0,75,20,65,1,3,0,0,verified
4-08-09-01,商业摄影师,2166,Graphic and multimedia designers,2,10,9,0.3765,0.668,0.614,3,4,3,0.3765,0,72,25,65,1,3,0,0,verified
4-08-09-02,冲印师,3941,Photographers,3,10,9,0.4065,0.706,0.6645,3,4,4,0.4065,0,55,30,45,1,2,0,0,unmatched
4-08-10-01,陶瓷工艺师,2149,Engineering Professionals Not Elsewhere Classified,2,10,9,0.3695,0.645,0.6305,2,4,4,0.3695,0,75,40,60,1,3,0,0,unmatched
4-08-10-02,化工生产现场技术员,3122,Chemical technicians,3,10,9,0.3155,0.7045,0.675,2,4,4,0.3155,0,72,45,65,1,3,0,0,verified
4-09-01-01,河道修防工,7131,Building Frame and Related Trades Workers,7,10,9,0.4475,0.723,0.6965,3,4,4,0.4475,0,65,85,40,1,3,0,0,verified
4-09-01-02,水工混凝土维修工,7126,Building and related trade workers,7,10,9,0.443,0.6825,0.587,3,4,3,0.443,0,65,75,40,1,2,0,0,verified
4-09-01-03,水工土石维修工,7119,Building and Related Trades Workers Not Elsewhere Classified,7,10,9,0.4125,0.7285,0.7135,3,4,4,0.4125,0,65,85,40,1,2,0,0,unmatched
4-09-01-04,水工监测工,3126,Surveying and Mapping Technicians,3,10,9,0.481,0.696,0.655,3,4,4,0.481,0,65,35,60,1,3,0,0,unmatched
4-09-01-05,水工闸门运行工,3313,Electrical and electronics trade assistant,3,10,9,0.4795,0.717,0.5205,3,4,3,0.4795,0,65,45,60,1,3,0,0,verified
4-09-02-01,水文勘测工,3126,Surveying and Mapping Technicians,3,10,9,0.485,0.6695,0.636,3,4,4,0.485,0,65,45,60,1,3,0,0,unmatched
4-09-02-02,水文勘测船工,5131,Water Transport Operators,5,10,9,0.398,0.6775,0.608,3,4,3,0.398,0,65,45,60,1,3,0,0,verified
4-09-03-01,水土保持员L,3140,Environmental Protection Technicians,3,10,9,0.3395,0.604,0.7555,2,3,4,0.3395,0,65,45,70,1,3,0,0,unmatched
4-09-04-00,灌区管理工,8331,Water and Wastewater Plant Operators,8,10,9,0.6165,0.7381,0.786,3,4,4,0.6165,0,55,45,60,1,3,0,0,verified
4-09-05-01,自然保护区巡护监测员L,3126,Environmental Protection Technicians,3,10,9,0.354,0.5795,0.651,2,3,4,0.354,0,65,75,60,1,3,0,0,unmatched
4-09-05-02,草地监护员L,6130,Agricultural and Fishery Workers,6,10,9,0.4355,0.7035,0.6975,3,4,4,0.4355,0,65,75,40,1,3,0,0,verified
4-09-06-01,野生动物保护员L,3126,Forestry and Conservation Technician,3,10,9,0.455,0.6535,0.617,3,4,3,0.455,0,65,45,60,1,3,0,0,unmatched
4-09-06-02,野生植物保护员L,3126,Environmental Protection Professionals,3,10,9,0.3985,0.6825,0.671,3,4,4,0.3985,0,65,75,60,1,3,0,0,unmatched
4-09-06-03,标本员,3941,Other Service Workers,3,10,9,0.262,0.5845,0.728,2,3,4,0.262,0,65,45,40,1,2,0,0,unmatched
4-09-06-04,展出动物保育员,5120,Animal Keepers,5,10,9,0.363,0.7165,0.658,2,4,4,0.363,0,65,45,70,1,3,0,0,verified
4-09-07-01,污水处理工L,3122,Environmental Protection Technicians,3,10,9,0.417,0.678,0.583,3,4,3,0.417,0,55,45,40,0,0,0,0,verified
4-09-07-02,工业固体废物处理处置工L,7139,"Plant and Machine Operators, Not Elsewhere Classified",7,10,9,0.4535,0.7055,0.6055,3,4,3,0.4535,0,65,75,40,1,3,0,0,unmatched
4-09-07-03,危险废物处理工L,7131,Refuse and Waste Collectors,7,10,9,0.436,0.7325,0.579,3,4,3,0.436,0,65,75,40,1,3,0,0,verified
4-09-07-04,碳排放管理员L,2149,Environmental Protection Professionals,2,10,9,0.4645,0.7265,0.635,3,4,4,0.4645,0,72,25,68,1,3,0,0,unmatched
4-09-07-05,碳汇计量评估师L/S,2149,Environmental Protection Professionals Not Elsewhere Classified,2,10,9,0.408,0.617,0.604,3,3,3,0.408,0,75,35,65,1,3,0,0,unmatched
4-09-07-06,建筑节能减排咨询师,2149,Engineering Professionals Not Elsewhere Classified,2,10,9,0.487,0.6715,0.564,3,4,3,0.487,0,75,20,70,1,3,0,0,unmatched
4-09-08-01,保洁员L,5151,Cleaning and Housekeeping Workers,5,10,9,0.4325,0.5975,0.5295,3,3,3,0.4325,0,35,75,40,1,2,0,0,unmatched
4-09-08-02,生活垃圾清运工L,9111,Garbage Collectors,9,10,9,0.528,0.7155,0.472,3,4,3,0.528,0,45,85,60,1,2,0,0,verified
4-09-08-03,生活垃圾处理工L,7131,Refuse Collectors and Related Workers,7,10,9,0.554,0.704,0.535,3,4,3,0.554,0,55,60,45,1,3,0,0,verified
4-09-09-00,有害生物防制员L,7139,Building and Related Trades Workers Not Elsewhere Classified,7,10,9,0.471,0.7685,0.66,3,4,4,0.471,0,65,45,70,1,3,0,0,unmatched
4-09-10-01,园林绿化工L,6130,Gardeners and Garden Maintenance Workers,6,10,9,0.4785,0.7305,0.5595,3,4,3,0.4785,0,45,75,30,1,2,0,0,verified
4-09-10-02,草坪园艺师,6130,Gardeners,6,10,9,0.4025,0.662,0.5775,3,4,3,0.4025,0,55,60,45,1,2,0,0,verified
4-09-10-03,盆景师,7412,Artisans and craft workers,7,10,9,0.385,0.663,0.69,3,4,4,0.385,0,65,40,55,1,3,0,0,verified
4-09-10-04,假山工,7112,Building and Related Trades Workers,7,10,9,0.3845,0.57,0.6155,3,3,3,0.3845,0,65,85,40,1,3,0,0,verified
4-09-10-05,插花花艺师,5143,Florists,5,10,9,0.4375,0.736,0.6435,3,4,4,0.4375,0,65,15,70,1,3,0,0,unmatched
4-10-01-01,婴幼儿发展引导员,4311,Teaching Professionals,4,10,9,0.4765,0.661,0.6175,3,4,3,0.4765,0,65,35,70,1,4,0,0,verified
4-10-01-03,保育师,5342,Child care workers,5,9,9,0.2475,0.507,0.638,2,3,4,0.2475,0,55,45,60,1,4,0,0,unmatched
4-10-01-04,孤残儿童护理员,5342,Home-based personal care workers,5,10,9,0.354,0.6265,0.739,2,4,4,0.354,0,65,45,70,1,4,0,0,unmatched
4-10-01-05,养老护理员,5321,Home-based personal care workers,5,10,9,0.3385,0.5735,0.759,2,3,4,0.3385,0,65,75,70,1,4,0,0,verified
4-10-01-06,家政服务员,5133,Domestic helpers,5,10,9,0.391,0.7015,0.6225,3,4,3,0.391,0,45,60,75,1,3,0,0,unmatched
4-10-02-01,裁缝,7412,"Tailors, Dressmakers, Hatters and Related Workers",7,10,9,0.419,0.6345,0.5695,3,4,3,0.419,0,65,40,70,1,3,0,0,verified
4-10-02-02,洗衣师,5120,Cleaning and Housekeeping Workers,5,10,9,0.469,0.647,0.745,3,4,4,0.469,0,45,35,60,1,3,0,0,verified
4-10-02-03,染色师,7412,"Textile, Garment and Related Trades Workers",7,10,9,0.5075,0.6575,0.5075,3,4,3,0.5075,0,65,40,30,1,2,0,0,verified
4-10-02-04,皮革护理师,7412,Shoe and Leather Workers and Related Workers,7,10,9,0.5025,0.6685,0.5775,3,4,3,0.5025,0,65,40,70,1,3,0,0,verified
4-10-02-05,织补师,7412,"Tailors, Dressmakers, Furriers and Shoemakers",7,10,9,0.354,0.5175,0.634,2,3,4,0.354,0,65,40,70,1,3,0,0,verified
4-10-03-01,美容师,5122,Beauty and Related Workers,5,10,9,0.4325,0.6665,0.5675,3,4,3,0.4325,0,65,40,70,1,3,0,0,unmatched
4-10-03-02,美发师,5133,Barbers,5,10,9,0.3695,0.7655,0.6745,2,4,4,0.3695,0,65,45,70,1,3,0,0,unmatched
4-10-03-03,美甲师,5133,Beauty and related workers,5,10,9,0.399,0.5985,0.639,3,3,4,0.399,0,65,15,70,1,3,0,0,unmatched
4-10-03-04,浴池服务员,5130,Cleaning and Housekeeping Workers,5,9,9,0.358,0.6255,0.577,2,4,3,0.358,0,45,60,55,1,3,0,0,unmatched
4-10-03-05,修脚师,5121,Health Associate Professionals,5,10,9,0.5245,0.6885,0.62,3,4,3,0.5245,0,65,15,70,1,3,0,0,unmatched
4-10-04-01,保健调理师,3257,Health Associate Professionals,3,10,9,0.51,0.68,0.518,3,4,3,0.51,0,65,45,70,1,3,0,0,verified
4-10-04-02,保健按摩师,3257,Massage Therapists,3,10,9,0.4665,0.7375,0.5625,3,4,3,0.4665,0,65,45,70,1,3,0,0,verified
4-10-04-03,芳香保健师,5120,Personal Care Workers,5,10,9,0.373,0.6395,0.663,2,4,4,0.373,0,65,45,70,1,4,0,0,verified
4-10-05-01,婚介师,2422,Social Workers,2,10,9,0.379,0.707,0.6505,3,4,4,0.379,0,72,10,85,1,4,0,0,verified
4-10-05-02,婚礼策划师,2431,Advertising and Marketing Professionals,2,9,9,0.3825,0.5955,0.587,3,3,3,0.3825,0,75,30,80,1,4,0,0,verified
4-10-05-03,婚姻家庭咨询师,2422,Psychological and Counselling Professionals,2,10,9,0.317,0.5725,0.683,2,3,4,0.317,0,75,10,85,1,4,0,0,verified
4-10-06-01,殡仪服务员,5322,Funeral Service Workers,5,10,9,0.423,0.5975,0.583,3,3,3,0.423,0,65,45,70,1,4,0,0,verified
4-10-06-02,遗体防腐整容师,3431,Dental Assistants,3,10,9,0.2645,0.5375,0.7075,2,3,4,0.2645,0,72,45,60,1,4,0,0,verified
4-10-06-03,遗体火化师,3322,Health Associate Professionals,3,10,9,0.425,0.7305,0.58,3,4,3,0.425,0,65,45,70,1,4,0,0,verified
4-10-06-04,公墓管理员,5140,Funeral Directors and Embalmers,5,10,9,0.3495,0.6005,0.6615,2,3,4,0.3495,0,55,40,65,1,4,0,0,unmatched
4-10-07-01,宠物健康护理员,4412,Animal Caretakers,4,10,9,0.384,0.69,0.6715,3,4,4,0.384,0,65,45,70,1,3,0,0,verified
4-10-07-02,宠物驯导师,4441,Animal Care Workers,4,10,9,0.4085,0.5995,0.688,3,3,4,0.4085,0,65,35,70,1,3,0,0,unmatched
4-10-07-03,宠物美容师,5149,Personal Care Workers Not Elsewhere Classified,5,10,9,0.3955,0.685,0.604,3,4,3,0.3955,0,65,45,70,1,3,0,0,unmatched
4-10-08-01,网约配送员,9412,Delivery Workers,9,10,9,0.4685,0.7155,0.556,3,4,3,0.4685,0,45,75,60,1,3,0,0,verified
4-10-08-02,汽车代驾员,8341,Taxi and chauffeur drivers,3,10,9,0.467,0.737,0.7095,3,4,4,0.467,0,65,15,70,1,3,0,0,verified
4-11-01-01,供电服务员,4321,Electrical and Electronics Trades Assistants,4,10,9,0.5915,0.6946,0.6475,3,4,4,0.5915,0,55,35,75,1,3,0,0,verified
4-11-01-02,电力交易员,2413,Financial and Investment Advisers,2,10,9,0.647,0.776,0.548,4,4,3,0.647,0,85,10,75,1,3,0,0,verified
4-11-01-03,综合能源服务员L,3139,Engineering Professionals Not Elsewhere Classified,3,10,9,0.457,0.7365,0.611,3,4,3,0.457,0,68,25,72,1,3,0,0,unmatched
4-11-02-00,燃气供应服务员,5131,Gas and water supply workers,5,10,9,0.471,0.732,0.529,3,4,3,0.471,0,45,35,60,1,3,0,0,verified
4-11-03-01,水供应服务员,4319,Service Workers Not Elsewhere Classified,4,10,9,0.5215,0.745,0.5365,3,4,3,0.5215,0,55,40,75,1,3,0,0,unmatched
4-11-03-02,村镇供水员,7133,Water Supply and Drainage Plant Operators,7,10,9,0.3415,0.558,0.6585,2,3,4,0.3415,0,55,60,75,1,3,0,0,verified
4-12-01-01,汽车维修工,7412,Automotive Electrician,7,10,9,0.5445,0.7045,0.5425,3,4,3,0.5445,0,65,75,40,1,3,0,0,verified
4-12-01-02,摩托车修理工,7412,Motor Vehicle Mechanics and Repairers,7,10,9,0.509,0.704,0.5745,3,4,3,0.509,0,65,75,40,1,3,0,0,verified
4-12-01-03,电池及电池系统维修保养师L,7412,Electrical and Electronics Trades Assistants,7,10,9,0.4245,0.6205,0.5585,3,3,3,0.4245,0,68,45,65,1,3,0,0,verified
4-12-02-01,计算机维修工,3513,Information and communications technology technical support associate professionals,3,10,9,0.5215,0.6435,0.6695,3,4,4,0.5215,0,65,45,70,1,3,0,0,verified
4-12-02-02,办公设备维修工,7412,Office Equipment Mechanics and Repairers,7,10,9,0.4315,0.6605,0.667,3,4,4,0.4315,0,65,45,60,1,3,0,0,verified
4-12-02-03,信息通信网络终端维修员S,3133,Telecommunications Engineering Technicians,3,10,9,0.4845,0.7525,0.706,3,4,4,0.4845,0,65,35,70,1,3,0,0,verified
4-12-03-01,家用电器产品维修工,7412,Electrical and electronics trades assistants,7,10,9,0.5705,0.68,0.444,3,4,3,0.5705,0,65,45,70,1,3,0,0,verified
4-12-03-02,家用电子产品维修工,7412,Electrical and Electronics Trades Assistants,7,10,9,0.444,0.695,0.586,3,4,3,0.444,0,65,45,70,1,3,0,0,verified
4-12-04-01,自行车与电动自行车维修工,7412,Bicycle and related repairers,7,10,9,0.413,0.66,0.6505,3,4,4,0.413,0,55,45,60,1,3,0,0,verified
4-12-04-02,修鞋工,7412,Shoemakers and related workers,7,10,9,0.398,0.52,0.56,3,3,3,0.398,0,45,60,30,1,2,0,0,verified
4-12-04-03,钟表维修工,7412,Watch and Clock Repairers,7,10,9,0.3035,0.527,0.6965,2,3,4,0.3035,0,65,45,30,1,3,0,0,verified
4-12-04-04,锁具修理工,7412,Locksmiths,7,10,9,0.4845,0.7435,0.5415,3,4,3,0.4845,0,65,45,70,1,3,0,0,verified
4-12-04-05,燃气具安装维修工,7412,Building frame construction workers,7,10,9,0.373,0.722,0.619,2,4,3,0.373,0,65,45,70,1,3,0,0,verified
4-12-04-06,照相器材维修工,7412,Photographic equipment repairers,7,10,9,0.3815,0.595,0.6355,3,3,4,0.3815,0,65,45,30,1,3,0,0,verified
4-12-05-01,乐器维修工,7412,Musicians and Singers,7,10,9,0.4405,0.652,0.574,3,4,3,0.4405,0,65,40,30,1,3,0,0,verified
4-12-05-02,钢琴调律师,7412,Musicians,7,10,9,0.5975,0.742,0.481,3,4,3,0.5975,0,65,15,70,1,3,0,0,verified
4-12-06-00,印章制作工,7412,Artistic and related occupations,7,10,9,0.5115,0.6885,0.5005,3,4,3,0.5115,0,65,40,70,1,3,0,0,verified
4-13-01-01,群众文化指导员,3423,Cultural and Artistic Workers,3,10,9,0.4865,0.7255,0.5885,3,4,3,0.4865,0,65,25,70,1,3,0,0,verified
4-13-01-02,礼仪主持人,3331,Conference and Event Planners,3,10,9,0.285,0.663,0.5915,2,4,3,0.285,0,72,25,85,1,4,0,0,verified
4-13-01-03,讲解员,4241,Tour Guides,4,9,9,0.2935,0.5265,0.5565,2,3,3,0.2935,0,65,25,85,1,3,0,0,unmatched
4-13-01-04,文化经纪人,2413,Advertising and Marketing Professionals,2,10,9,0.4975,0.709,0.5795,3,4,3,0.4975,0,75,20,80,1,4,0,0,verified
4-13-01-05,全媒体运营师S,2413,Advertising and Marketing Professionals,2,10,9,0.558,0.733,0.61,3,4,3,0.558,0,72,10,85,1,3,0,0,verified
4-13-01-06,版权服务师,2411,Lawyers,2,10,9,0.4305,0.7295,0.5695,3,4,3,0.4305,0,75,10,80,1,3,0,0,verified
4-13-01-07,档案数字化管理师S,4331,Library and Related Information Professionals,4,10,9,0.365,0.713,0.641,2,4,4,0.365,0,65,15,70,1,3,0,0,unmatched
4-13-01-08,图书馆服务员,4331,Library Technicians,4,10,9,0.4805,0.716,0.605,3,4,3,0.4805,0,45,35,60,1,3,0,0,unmatched
4-13-02-01,影视置景制作员,7126,Building frame constructors and related trades workers,7,10,9,0.247,0.606,0.78,2,3,4,0.247,0,65,75,60,1,3,0,0,verified
4-13-02-02,动画制作员,2166,Graphic and multimedia designers,2,10,9,0.493,0.641,0.5405,3,4,3,0.493,0,72,25,45,1,3,0,0,verified
4-13-02-03,影视烟火特效员,7412,"Film, Video and Broadcasting Assistants",7,10,9,0.333,0.642,0.656,2,4,4,0.333,0,72,45,60,1,3,0,0,verified
4-13-02-04,电影洗印员,3941,Other Service Workers Not Elsewhere Classified,3,10,9,0.3395,0.742,0.673,2,4,4,0.3395,0,55,40,30,1,2,0,0,unmatched
4-13-02-05,电影放映员,5141,Audio-visual and multimedia technicians,5,9,9,0.275,0.67,0.8125,2,4,4,0.275,0,45,30,60,1,3,0,0,verified
4-13-02-06,音响调音员,3431,Audio and Video Equipment Operators,3,10,9,0.4785,0.6665,0.5535,3,4,3,0.4785,0,72,35,65,1,3,0,0,verified
4-13-02-07,照明工,7413,Lighting Technicians,7,10,9,0.363,0.624,0.637,2,3,4,0.363,0,65,45,60,1,3,0,0,verified
4-13-02-08,影视服装员,3431,Fashion Designers,3,9,9,0.3985,0.652,0.5405,3,4,3,0.3985,0,65,35,70,1,3,0,0,verified
4-13-02-09,电视摄像员,2634,Film and Video Editors,2,10,9,0.418,0.6735,0.643,3,4,4,0.418,0,65,45,60,1,3,0,0,verified
4-13-03-01,考古探掘工,7126,Mining and Quarrying Workers,7,10,9,0.223,0.5535,0.716,2,3,4,0.223,0,65,45,70,1,3,0,0,verified
4-13-03-02,文物修复师,2149,Professionals in Conservation and Restoration,2,10,9,0.3065,0.599,0.7435,2,3,4,0.3065,0,75,40,65,1,3,0,0,unmatched
4-13-04-01,在线学习服务师,2424,Social Work Professionals,2,10,9,0.6075,0.761,0.544,3,4,3,0.6075,0,68,10,75,1,3,0,0,verified
4-13-04-02,国防教育辅导员,2424,Social Work Professionals,2,10,9,0.5395,0.713,0.5375,3,4,3,0.5395,0,72,25,78,1,3,0,0,verified
4-13-04-03,家庭教育指导师,2424,Social Work Professionals,2,10,9,0.362,0.6455,0.638,2,4,4,0.362,0,75,20,80,1,4,0,0,verified
4-13-04-04,研学旅行指导师,4319,Education Professionals Not Elsewhere Classified,4,10,9,0.465,0.6275,0.507,3,4,3,0.465,0,72,45,80,1,4,0,0,unmatched
4-14-01-01,医疗临床辅助服务员,5322,Medical Assistant,5,10,9,0.453,0.6665,0.5485,3,4,3,0.453,0,55,35,65,1,3,0,0,verified
4-14-01-02,医疗护理员,5321,Nursing associate professionals,5,10,9,0.2935,0.5745,0.7065,2,3,4,0.2935,0,55,60,65,1,4,0,0,verified
4-14-01-03,健康照护师,5321,Home-based personal care workers,5,10,9,0.3755,0.6355,0.6245,3,4,3,0.3755,0,65,45,70,1,4,0,0,verified
4-14-01-04,呼吸治疗师,3251,Nursing Professionals,3,10,9,0.359,0.598,0.641,2,3,4,0.359,0,75,30,65,1,3,0,0,verified
4-14-02-01,营养师,2222,Nursing Professionals,2,10,9,0.414,0.7235,0.586,3,4,3,0.414,0,75,10,80,1,4,0,0,verified
4-14-02-02,健康管理师,2222,Nursing Professionals,2,10,9,0.3235,0.701,0.6845,2,4,4,0.3235,0,72,20,75,1,3,0,0,verified
4-14-02-03,生殖健康咨询师,2422,Social Work Professionals,2,10,9,0.505,0.756,0.655,3,4,4,0.505,0,72,10,85,1,4,0,0,verified
4-14-02-04,出生缺陷防控咨询师,2422,Social Work Professionals,2,10,9,0.3695,0.705,0.6305,2,4,4,0.3695,0,85,10,80,1,4,0,0,verified
4-14-02-05,老年人能力评估师,2222,Nursing Professionals,2,10,9,0.3945,0.6505,0.619,3,4,3,0.3945,0,72,25,68,1,3,0,0,verified
4-14-03-01,助听器验配师,3257,Audiologist,3,10,9,0.4655,0.7565,0.5345,3,4,3,0.4655,0,72,25,68,1,3,0,0,verified
4-14-03-02,口腔修复体制作师,3212,Dental Technicians,3,10,9,0.2885,0.7115,0.7115,2,4,4,0.2885,0,72,45,60,1,3,0,0,verified
4-14-03-03,眼镜验光师,2262,Optometrists,2,10,9,0.464,0.6705,0.62,3,4,3,0.464,0,72,25,68,1,3,0,0,verified
4-14-03-04,眼镜定配工,7412,Opticians,7,10,9,0.5145,0.722,0.4915,3,4,3,0.5145,0,65,15,70,1,3,0,0,verified
4-14-03-05,听觉口语师,2222,Speech Therapists,2,10,9,0.376,0.6895,0.6005,3,4,3,0.376,0,75,20,85,1,4,0,0,verified
4-14-03-06,康复辅助技术咨询师,3257,Rehabilitation and Prosthetic Technicians,3,10,9,0.3825,0.723,0.64,3,4,4,0.3825,0,72,25,68,1,4,0,0,verified
4-14-03-07,康复治疗师,2262,Nursing Professionals,2,10,9,0.45,0.6285,0.5695,3,4,3,0.45,0,72,45,68,1,3,0,0,verified
4-14-04-01,防疫员,3222,Nursing Professionals,3,10,9,0.4985,0.6915,0.605,3,4,3,0.4985,0,65,45,70,1,3,0,0,verified
4-14-04-02,消毒员,5131,Cleaning and related workers,5,10,9,0.263,0.654,0.727,2,4,4,0.263,0,55,40,60,1,3,0,0,verified
4-14-04-03,公共场所卫生管理员,3412,Environmental Health and Safety Officers,3,10,9,0.399,0.6745,0.618,3,4,3,0.399,0,65,35,70,1,3,0,0,verified
4-14-04-04,社群健康助理员,5342,Home-based personal care workers,5,10,9,0.322,0.7065,0.716,2,4,4,0.322,0,55,35,75,1,3,0,0,unmatched
4-14-05-01,社会体育指导员,4311,Physical Education Teachers,4,9,9,0.3565,0.5875,0.59,2,3,3,0.3565,0,65,45,70,1,3,0,0,verified
4-14-05-02,体育场馆管理员,4331,Building and housekeeping managers,4,10,9,0.422,0.674,0.638,3,4,4,0.422,0,55,40,65,1,3,0,0,unmatched
4-14-05-03,游泳救生员,4341,Swimming and Lifeguard Instructors,4,10,9,0.4015,0.527,0.679,3,3,4,0.4015,0,65,85,40,1,3,0,0,unmatched
4-14-05-04,康乐服务员,5223,Receptionists,5,10,9,0.463,0.633,0.6625,3,4,4,0.463,0,45,35,65,1,3,0,0,verified
4-14-05-05,体育经纪人,2424,Business Professionals Not Elsewhere Classified,2,10,9,0.51,0.729,0.65,3,4,4,0.51,0,75,20,80,1,4,0,0,verified
4-14-05-06,电子竞技运营师,2424,Advertising and Marketing Professionals,2,10,9,0.4605,0.744,0.575,3,4,3,0.4605,0,72,25,68,1,3,0,0,verified
4-14-05-07,电子竞技员S,4414,Sports and related workers,4,10,9,0.4385,0.76,0.691,3,4,4,0.4385,0,85,40,60,1,3,0,0,verified
4-14-06-01,森林园林康养师,3422,Nursing Professionals,3,10,9,0.42,0.6975,0.592,3,4,3,0.42,0,65,45,70,1,3,0,0,verified
4-14-06-02,民宿管家,5331,Hotel and restaurant managers,5,10,9,0.4185,0.714,0.568,3,4,3,0.4185,0,65,25,75,1,4,0,0,unmatched
5-01-01-01,种子繁育员,6130,Agricultural Technicians,6,10,9,0.452,0.7385,0.612,3,4,3,0.452,0,65,45,30,1,2,0,0,verified
5-01-01-02,种苗繁育员,6130,Crop Production Workers,6,10,9,0.4565,0.617,0.5435,3,3,3,0.4565,0,65,45,30,1,3,0,0,verified
5-01-02-01,农艺工,6130,Crop and Horticultural Growers,6,10,9,0.42,0.7955,0.649,3,4,4,0.42,0,65,75,40,1,3,0,0,verified
5-01-02-02,园艺工,6130,Gardeners,6,10,9,0.307,0.626,0.693,2,4,4,0.307,0,45,75,30,1,2,0,0,verified
5-01-02-03,食用菌生产工,6130,Agricultural and Fishery Workers,6,10,9,0.2755,0.6755,0.709,2,4,4,0.2755,0,45,35,20,1,2,0,0,verified
5-01-02-04,热带作物栽培工,6130,Crop and Horticultural Workers,6,10,9,0.391,0.716,0.6,3,4,3,0.391,0,45,85,30,1,2,0,0,verified
5-01-02-05,中药材种植员,6130,Crop and Horticultural Workers,6,10,9,0.365,0.637,0.663,2,4,4,0.365,0,65,45,30,1,2,0,0,verified
5-02-01-00,林草种苗工L,6130,Forestry and Related Workers,6,10,9,0.436,0.6965,0.595,3,4,3,0.436,0,55,60,45,0,0,0,0,verified
5-02-02-00,造林更新工L,6130,Forestry and Related Workers,6,10,9,0.359,0.638,0.646,2,4,4,0.359,0,55,85,40,1,3,0,0,verified
5-02-03-01,护林员L,5111,Forestry and Related Workers,5,10,9,0.3535,0.672,0.684,2,4,4,0.3535,0,45,85,40,1,3,0,0,verified
5-02-03-02,森林抚育工L,6130,Forestry and Related Workers,6,10,9,0.3455,0.704,0.6515,2,4,4,0.3455,0,45,85,30,1,2,0,0,verified
